Origin,Max Growth (approx),Poisonous for pets,Temperature,Light,Watering,Soil,Re-Potting,Fertilizer,Humidity,Propagation,Common Problems,Common Name,Botanical Name
South America.,Height 30 in/75 cm.,Toxic to cats and dogs.,The amaryllis within the growing period (winter – spring) prefers temperatures of 70 – 75F°f (21 – 24°c) and from September – November (or early December) 55°f (13°c). After the plant as flowered the temperature can be kept at around 70 – 75F°f (21 – 24°c) which will keep the flower healthier longer.,Bright light without too much direct sunlight is preferable.,"During the growing and flowering period, water when the top inch of the soil becomes dry. Once the leaves are cut away you can stop watering for about 8 – 10 weeks (dormant period) or water sparingly until new growth appears. When new leaves appear water frequently again when the top inch of soil becomes dry. Overwatering may cause the bulb to rot.",You can use equal part perlite and peat or two parts loam soil and one part perlite. Your local garden store will offer other suitable options as well.,Your hippeastrum can be re-potted if the bulb seems to have outgrown the pot or every 2 years just before the dormant growing period (Nov – Dec). The pot size needs to be approximatively 2 inches wider each side of the bulb.,After the dormant period (Nov -Dec) begin feeding with a liquid fertilizer once every 2 weeks once you begin to see leaf shoots appearing. Continue until the leaves are cut down ready for the dormant period (Sept – Nov).,Normal room humidity is fine.,These can be propagated by seed (takes up to 5 years to mature and flower) or bulb offsets. Propagating with offsets takes about half the time to produce a mature plant that flowers compared to planting seeds (about 3 years).,,Amaryllis, Hippeastrum (botanical/scientific).
Eastern Africa.,Diameter (micro – 3in) – (large – 16in).,Non toxic dogs and cats.,Room temperatures of around 65°f / 16°c — 75°f / 24°c are ideal. Try not to allow temperatures to decrease lower than 60°f / 15.5°c and it’s advised to avoid cold drafts or abrupt temperature changes.,"The African violet thrives in bright light, although too much direct sunlight will cause leaf problems (edges turn yellow, patches, or develop holes). I have grown mine, at best – close to east facing windows, but many other people grow them close to the south facing side. Growers will use artificial lighting to encourage blooms during winter time, using fluorescent lighting tubes. However, many of us do not want to use lighting and have the expense when we are happy enough to see the spring and summer blooms.","Re-pot when needed (room temperature not below 70°F./21°C). I would always do this at least once every year, or even twice a year. There is no need to increase the pot size unless it becomes pot bound or has grown larger.",A fast draining soil mix is best to use. I actually use the African V soil mix with 1 part vermiculite because it’s cheap enough and easy to find in many stores.,"It’s wise to remove dying leaves, flowers and stems as soon as possible to encourage new growth. Remove new side shoots (suckers) as soon as they begin to grow as well. Removing crowns is to be done very carefully.","Fertilize every couple of weeks with a balanced fertilizer that’s urea-free. Or even better, a solution specifically for A.violets.","These need high humidity and plenty of gentle misting (with lukewarm water, not in direct sunlight and only the leaves) for healthy growth and to flower well. You can use a humidity tray to support the correct levels that need to have small pebbles or a layer of gravel at the bottom with water added below the surface.","A.voilets are propagated by leaf cuttings (Chimera AVs only by suckers), placed into a potting mix.",,African violet, Saintpaulia (botanical/scientific) .
South America.,4ft tall or more if not pruned.,Toxic for cats and dogs.,Average room temperatures of 55 – 75°F (13 – 24°C) are best suited for Begonias…and no less than 55°F.,"This plant is not in favor of direct sun. This is because the leaves are sensitive to getting scorched. In their natural habitat, most Begonias grow under cover. Bright light is best and during the winter some morning or late afternoon sun is fine.","From spring to fall you will need to water this plant often, especially while it’s in bloom. Keep the soil moist to the touch slightly, but do not overwater. During winter cut down watering and allow the top soil to become dry to the touch before watering again.",African Violet ready-made potting soil works well. Otherwise use a rich soilless well-draining potting mix.,"While the plant is young I would repot it every year in a pot slightly bigger. Once it matures every 2 years. Clay pots work well because they tend to release moisture easier, preventing root problems from stagnant water. An added benefit of using a clay pot is it will keep the plant more sturdy once it matures in height and prevent it from toppling over.",From spring to fall feed the plant while the soil is damp every 2 weeks. Use a high potassium diluted feed of 5-10-5. This seems to work well in keeping the leaves and flowers looking healthy.,"This plant enjoys a good amount of humidity. You can mist around the plant area, but I advise you not to water the leaves in case it causes spots or patches on them.",You may take a few inches (4 – 6in) or more of stem cuttings with or without a leaf attached and without flowers. You want a node or more on the stem where a new flower will begin to grow. The stem cutting can be placed in water or in perlite (use a rooting hormone with perlite) until growth appears then it can be potted in soil. I prefer to stick with placing it in water to see the roots form. These can also be grown from seed which is much more difficult for the average grower.,,Angel wing begonia, Begonia coccinea (botanical/scientific)
South Africa.,24in tall.,"Non toxic for cats, dogs and horses.",Average temperatures of 55 – 75°F (13 – 24°C) are suitable.,"A lover of direct sunlight and bright windowsills. Place close to a south, east or west facing window to provide enough sunlight.",It’s best to keep the soil moist at all times. Once the soil becomes slightly dry to the touch provide water straight away or the plant will begin to wilt very quickly.,A peat based potting mix with 2 parts peat and 1 part perlite is suggested.,,"While flowering, feed with a balanced liquid fertilizer every 2 weeks.","Gerbera’s quite like above average humidity levels, although average is absolutely fine.",These are mostly propagated with seeds although the parent plant can also be divided or root cuttings can be used.,,"Barberton, Gerbera, Transvaal Daisy", — Gebera Jamesonii (botanical/scientific)
South Mexico and Central America.,Height 2 – 3ft.,No.,"The Beach Spider Lily is capable of withstanding temperatures that drop into the 40ºF (4°C) range, and as high as 90ºF (32ºC). They must be protected against frosts by all means, or the plant will die back to the bulb stage.",This plant requires partial shade to full sun. Make certain it can get enough light from the pot location.,"Hymenocallis littoralis demands wet conditions all year long. The bulbs can be started in nothing except water, but need to be moved to soil once they begin to sprout. Soil should be kept moist, but never soggy. Do not allow standing water in the saucer underneath.",These plants prefer a standard potting soil mixed with bark or pumice at a 1:1 ratio. The pH of the soil chosen needs to be between 5.0 and 7.5 for the continued health of the plant.,"Every two years, this plant requires re-potting and an infusion of new soil. Move the plant to a size larger pot, and mix in new soil to fill the gaps. This should be done when the plant is not flowering.",You may fertilize your plant once every two weeks with a diluted balanced fertilizer. Seaweed based fertilizers have been reported to produce the best results.,"This plant is happy with normal air humidity, as long as its soil is properly moist. If the soil has been allowed to dry out, the leaves and flowers may be misted with a spray bottle to combat dehydration effects.",This plant is propagated either by seed or by dividing rhizomes. Maturity from seed takes several years. It is easier to break off a piece of the bulb and propagate from it.,,Spider Lily, Hymenocallis littoralis (botanical/scientific).
South Africa.,Height 24 in/60 cm.,Toxic to cats and dogs.,Temperatures from 65 – 75F°f (18 – 24°c) are best suited.,"Bright and direct sunlight is advisable. To stand any chance of getting the belladonna lily to flower it’s best to have the plant near a south-facing window, where it can get the most hours of sunshine.","Keep the soil moist (not soaked) during the growing and flowering period. During the rest period after the leaves have died down, do not water until the stalk appears and then begin watering as normal.",You can use equal part perlite and peat or two parts loam soil and one part perlite. Your local garden center may also be able to offer other suitable options. Make sure the bulb is planted within a large plant pot.,Re-pot in a fairly large pot that gives the plant plenty of room for it’s roots. Once every 2 -3 years should be fine.,"Once the leaves appear you can fertilize with a diluted liquid fertilizer once a month. Do not feed during the rest period and begin again once the stalk appears. Feeding will help belladonna lily plants to flower, however, it’s not necessary to do so and it’s much better to give less or none at all – than too much.",Normal room humidity is fine.,"These can be propagated by seed, bulb offsets or rhizome’s.",,"Belladonna lily, March lily and naked lady.", Amaryllis belladonna (botanical/scientific).
South Africa.,Height 6ft (can be kept to 3ft indoors).,"Mildly toxic for cats, dogs","The Bird of Paradise requires moderate temperatures year-round. They can tolerate temperatures as low as 55 ºF (13 ºC), but prefer to remain in the 70-90 ºF (21-32 ºC) range. Above 70 ºF (21 ºC), care instructions do change slightly.","This plant demands bright, yet indirect, sunlight year-round. Too much sunlight will injure the flowers. Above 70 ºF (21 ºC), this plant should be relocated to a partial shade environment in order to avoid sunburn on the flowers.","During the summer months, the soil should be kept moist through regular watering. Throughout the fall and winter, permit the soil to almost dry out before watering. Never permit water to stand in the saucer underneath the plant.",Strelitzia reginae does well in almost any type of soil. A standard potting soil will suffice for this plant’s continued health.,"Check the roots of this plant in the late winter. If the roots appear to be cramped in the current container, have someone assist you in moving it to a size larger pot. Be careful not to injure the spathe during the transplant process. Also, re-pot young plants which are growing early spring.",Offer this plant a balanced fertilizer every two weeks throughout the spring and summer. During the fall and winter months fertilization to once every month.,"This plant prefers normal air humidity inside the home. During the winter months, you can mist the leaves of the plants to simulate rainfall, which will also improve humidity during the months that artificial heating is used.","The Strelitzia can be propagated from seeds or by division. The seeds are woody, brown and small, with tufts of orange on them. When propagating from seed, it will take the newly formed plant up to three years to begin blooming. When propagated by division, the process interrupts the growth cycle of the parent plant, resulting in a year without blooms.",,"Bird of Paradise, Strelitzia, Crane Flower common). Strelitzia Reginae (botanical/scientific).",
South America.,Height 18 in/45 cm.,"Non toxic for cats, dogs",Average to just above average temperatures of 65 – 80ºF (18 – 27ºC) are best suited. Avoid lower than 55ºF (13ºC).,A lover of bright light. A combination of some sun and shade provided throughout the day is advised or filtered sun.,Fill the center vase with water – using distilled or rain-sourced water and change it every four to six weeks. The soil needs to be kept slightly moist but not soaked.,This bromeliad does not need a lot of feeding. Once a month you can add a diluted liquid fertilizer (half the recommended strength on the instructions) to your misting bottle. Overfeeding can cause leaf color loss.,"You will only need to re-pot if the container used is no longer large enough. It’s worth renewing the soil once a year, but if the soil mix has nutrients added to it – do not feed for the next month or two.","Providing average to above-average humidity is advisable. To improve levels during summer or when artificial heating is used, you can mist the leaves, or provide a humidity tray for the plant and it’s container to sit on. If you notice the leaves turning brown and dry this could be caused by dry air (lack of humidity).","Once the plant has flowered the mother plant will begin to die and produce pups – rather than grow its leaves any further. These offsets are removed and used to create new plants by cutting them off as close to the main plant as possible, usually when they begin to grow roots or they’re about a third of the size of the mother plant.","Once the plant has flowered the mother plant will begin to die and produce pups – rather than grow it’s leaves any further. These offsets are removed and used to create new plants by cutting them off as close to the main plant as possible, usually when they begin to grow roots or they’re about a third of the size of the mother plant.",,Blushing bromeliad, Neoregelia carolinae (botanical/scientific).
East Africa.,24in (60cm) in height.,Non-toxic to cats and dogs.,Average room temperatures from 65°F/18.3°C – 75°F/23.8°C (not below 60°F/15.5°C).,Bright light is key to these blooming and during winter. Direct sun light is be to avoided during the summer.,Keep the soil moist at all times but not soaking wet. During the growing season you will notice they drink a lot.,A well draining potting soil mix will suffice.,"Re-pot during spring if the plant has become pot bound, but keep in mind the patient lucy likes plenty of roots in it’s pot. When re-potting use a pot slightly bigger than the last one the plant resided in – with plenty of drainage holes.",Impatiens walleriana’s grow well when fed with a balanced liquid fertilizer during spring and summer. I would say feeding once every 4 weeks is about right.,Most indoor humidly levels are fine for this plant.,Stem cuttings (3 -5 inches) can be taken at any time of the year and re-potted to produce new busy lizzies. These can also be grown by seed which are sown during spring.,,Busy Lizzie and Impatient Lucy, — Impatiens Walleriana (botanical/scientific).
South Africa.,Flower stalk 3ft (90cm) in height.,Calla lilies are toxic to cats and dogs.,"These calla lily flowers can be rather picky about their temperatures. For ideal growing conditions expose the bulbs to days no hotter than 60°F and no colder than 55°F. The above-ground plant can tolerate temperatures as high as 70°F. If your home is hot, use mulch to keep the bulb cooler in its pot.",Full sun or partial shade when outdoors.  Indoors bright indirect light unless they are used to the direct sunlight.,This plant requires plenty of bright sunlight during non-peak hours of the day. Provide it with a sunny window facing east or west for best results.  They can handle full or partial sun once acclimated.,Standard potting soil is a good mixture for this plant. Avoid potting soils with an unbalanced pH or too much fertilizer mixed in.,"This plant takes to re-potting well. Simply dig the plant out of the soil, including the entire bulb. Replant the bulb with the shoots pointing up at least three inches deep in the soil. Cover, and water once. Wait until new growth is evident before watering again.","Normally it doesn’t need fertilizer. If you desire better growth, use a fertilizer with no ammonium in it. Use this in a mixture of 1 part fertilizer to 1 gallon of water (1:1) in the growing season, and fertilize once every two weeks for a single season only. Continued fertilization for long periods of time will harm the plant.","Normal room humidity is acceptable for this plant, as long as the soil is kept moist. This is especially true during winter.","They can reproduce through seeds and vegetatively via rhizomes. If the plant is fertilized, small black berries will form. These can be dried out and planted in three inches of potting soil. This will form new bulbs.Otherwise, you can dig up the rhizome and break off a section of it. Permit this to dry for two days, then plant with the non-smooth side up and water according to re-potting instructions. You can also plant the rhizomes outside if you are in the right temperature zone after the soil has warmed. Favorable growing seasons are late spring and early summer.",,Calla lily, — Zantedeschia aethiopica (botanical/scientific).
East Asia.,"Height 3ft, width 2ft.",Not known.,Average warmth is fine of approximately 60-75°F (15-24°C) and no lower than 45°F (8°C).,"A lover of bright light, not direct sunlight (or at least not much).","Water when the soil begins losing its moisture to the touch, and naturally, reduce watering during winter.",Feed with a balanced fertilizer once a month from spring – to fall and then maybe once every other month after.,Re-pot only when needed (spring). When it becomes pot bound move the plant to a pot the next size up.,"Water when the soil begins losing it’s moisture to the touch, and naturally, reduce watering during winter.",Average house humidity is advised. Misting leaves will improve humidity during the summer months.,This plant can be propagated by seeds (early spring) or stem cuttings (during spring a summer).,"Plants that are too hot will refuse to produce berries, even after producing flowers. Exposure to excessive sunlight will cause the leaves to burn and the berries to shrivel.","Coral berry, christmas berry, coral ardisia", Ardisia crenata (botanical/scientific).
Central and South America.,12 – 24in tall.,"Non toxic for cats, dogs and horses.",They do well in temperatures varying from 55 degrees at night up to 90 degrees in the day. You can safely put your orchid outside during the summer months. A drop in temperature during the evening is required.,"Orchids don’t like direct sunlight as it can damage the leaves. The best is medium or filtered light and a room on the southern, eastern or western side. Morning direct sun is fine but not afternoon summer direct sunlight. You can go down the artificial lighting route if required and this is what many professional growers do.","Cattleyas like to dry out between the waterings. The established plants should be watered from a week to ten days, and young plants from five to seven days. To make sure you are doing the best you can, you can place the pot in a bowl of water for 10-15 minutes – this works the best for the plants in clay pots. If your orchid is planted in a plastic pot, put it in an empty bowl and slowly add water. Keep it there for 10-15 minutes. In both cases you can also put the plant in a sink and use tepid water for a minute or so.","They do well in soiless mixtures, for example bark, rocks, or perlite (their roots need air) . They are epiphytes in their natural habitat meaning they cling to trees and rocks without soil. Wet soil for a period of time will kill these plants.",,Any balanced orchid fertilizer is good. Use it weekly.,Around 40% – 70%. Place the pot on pebbles in water to create more humidity from the water evaporating from the pebble tray.,"Propagate in spring, after blooming period. This is done by dividing the plant and there should be at least three shoots on each division.",,Corsage Orchid, Cattleya Orchid (botanical/scientific)
"Middle East, Greek Islands, and elsewhere.",12 inches tall,Toxic to cats and dogs.,,,,,,,,,,"Cylamen, florist cyclamen", — C. Cyclamen (botanical/scientific).
Brazil.,Height 1 – 2ft.,Non-toxic to cats and dogs.,"It likes humidity and warmth. Not lower than 60ºF (16ºC). It will do well in a room temperature as long as there is a high level of humidity. The temperature in the room must be stable, and not change much.","A bright room, but no direct sunlight as that can make the color of the leaves fade away.","Eternal flame likes to have an even amount of water. It is especially important during the summer months, when it is warmer. It all depends on the type of compost you use. Check the label first.",The best for potting the Calathea Crocata is soil based potting compost with some peat moss (around 25%). Remember to allow the water to drain easily.,The best time for this is late June.,"Standard liquid fertilizer, used every two weeks, during the growing period.",High. It is best to mist the plant every day with room temperature water. If it does not have enough humidity the color of the leaves will be spoiled by brown spots.,"Propagate (division) in late June. The new plants need to have some leaves and sturdy roots. Plant 5-8cm deep, keep the soil moist and temperature around 18º C.",,Eternal Flame, Calathea Crocata (botanical/scientific).
Brazil.,12in tall.,Toxic to cats and dogs.,Temperature: Between 60 – 70°F (15 – 21°C) “no higher than 75°F – 24°C” seems to be the ideal temperatures during the day and no lower than about 55°F (13°C) during the night.,"A good shaded spot within the home from direct sunlight is ideal. Sat back from a window in a bright room is suitable, but if the room is more north facing, place much closer to the window.","One of the worst things you can do with bulbs is over-water, which rots the bulb. Allowing the soil to begin to dry at the top is a good measurement of when to water again. Remember to stop watering if the plant becomes dormant.","Most potting mixes that drain well, which are also well aerated will do the trick.","You may want to re-pot your plant once every 1 – 2 years (during dormancy period) and use the same pot or move up a size bigger, unless your removing offsets which reduces the size of the plant “or keeps it to the same size”.",A diluted liquid fertilizer is helpful to use during the growing period. Feed once every 1 or 2 weeks. No feeding is required during dormancy.,Average room humidity is fine.,If you want to propagate your oxalis triangularis you’ll find it’s best to do this towards the end of it’s dormant period (I would do this after 2 weeks of dormancy to be sure of timing). The bulb will have to be removed from the pot and then you may remove the small bulb offsets which are re-potted to produce new plants. Be patient with the new plants and expect them to appear a little later than the main plant.,,"False shamrock, purple sharock, wood sorrel", — Oxalis Triangularis [Syn. Oxalis regnellii] (botanical/scientific).
Central and South America.,12 – 18 inches in height.,Toxic to cats and dogs.,"Average room temperatures from 65°F/18.3°C – 75°F/23.8°C (maybe a little higher and not below 60°F/15.5°C). Lower temperatures will affect it’s leaves (may turn yellow), impede it’s growth and flowering.",The flamingo flower is a lover of light – but not direct sunlight.,Keeping the soil moist at all times within the summer is advisable. Water every couple of days and less in the winter.,"A good draining soil is best suited, such as a peat moss based potting soil and perlite.","These are re-potted within spring usually every 2 years, or when they become pot-bound.",,"The flamingo loves being misted with a light spray of lukewarm water, regulary. Cleaning lightly with a gentle sponge is advised, which improves humidity – and makes it look healthy.",Propagate by dividing the plant when you decide to re-pot in spring. Having a good temperature above 75°F/23.8°C for the first few weeks will give the plant a great start in life.,,"Flamingo flower, pigtail plant", — Anthurium scherzerianum (botanical/scientific).
South America.,"Height 18 in/45 cm, diameter 10 in/25 cm.",Non-Toxic to cats and dogs.,To bring them in to flower you may need to keep the temperature up to around 75°f / 24°c and then average room temperatures above 65°f / 18.3°c at any other time.,Bright light without direct sunlight is preferable.,"The vase needs to be kept topped up with water which should be emptied and replaced every two-three weeks The soil is best watered when it becomes slightly dry at the top, and avoid over-watering. Using a pot that has sufficient drainage holes is advised.",A peat-based potting mix is fine – as long as it drains well.,These should not need re-potting if they have matured. Smaller urn plants may need a slightly bigger container to give the roots more room for growth.,"Feeding with a liquid diluted fertilizer from May – September is ideal, once every 4 weeks. They can also be mist sprayed with a foliar fertilizer to provide the foliage with nutrients.","Normal humidity indoors should be fine, and misting the plant leaves will help too.","These are easily propagated after the offsets have grown over 5 inches tall, and are a few months old. They need to be separated from the container they have been growing inside with roots attached and then placed into a suitable-sized container with a moist soil mix.",,Flaming Sword, Vriesea splendens (botanical/scientific).
