Origin,Max Growth (approx),Poisonous for pets,Temperature,Light,Watering,Soil,Re-Potting,Fertilizer,Humidity,Propagation,Common Problems,Common Name,Botanical Name
South America.,25 – 30 cm tall.,Non-toxic to cats and dogs.,"Ideal temperatures of 65-75ºF (18-24ºC), and no lower than 50ºF (10ºC).","Bright light and, for the variegated types, some direct sunlight (a couple of hours) can help them grow well. So, if the leaves are dark green in color, it’s best not to provide direct sun as it will harm them, but the variegated types may lose variegation if enough light is not provided. South, east, or west-facing windows are best suited, depending on the leaf color.","The baby rubber plant is fairly easy to water. Allow the topsoil to dry out completely, and then water thoroughly. You do not want to overwater this plant and allow the soil to become waterlogged….so it might be best to lean towards less rather than too much when you first start growing Peperomias, as less harm can be caused compared to overwatering.During winter, water sparingly as the thick leaves will store water, so don’t get too concerned about the soil is dry.","A peat-based soil that drains well is best. 2 parts peat and 1 part perlite or sand is a good mix. Also, other mixes will work well, but the main point is for the medium to drain well and be well aerated.","You will not need to repot or pot up a size very often, as this plant has a small root system. So, it’s a good idea to change the soil or at least the top soil annually, and if a young plant has outgrown its current pot, you may repot a size up during spring. Better to lean towards a smaller pot than a pot too large to prevent the soil from becoming waterlogged. Shallow pots are a good option for Peperomias.","During spring – while the plant is growing, use a diluted liquid fertilizer once every two weeks and once a month during summer. No feeding is required from autumn to spring","This species does like a humid environment. During the warmer months, you can mist the leaves and/or place the plant on a pebble tray with water at the bottom. So, most homes should be fine with their natural humidity if the air is not dry.","An easy method to propagate is to take a few centimeters of stem tip cuttings. Remove a tip (petiole) with about 5 – 8 cm of the tip with one or two leaves on it. Plant the cutting in a very small pot with moist potting mix, and try to provide warm temperatures of about 20ºC (68ºF), and plenty of bright light (warmth and light is the key to success). So, you may want to use a rooting hormone on the cut being planted.The baby rubber plant can also propagate with leaf cuttings, although variegated types may lose the variegation. Also, you may want to experiment and try a few leaves and stem tips to see what propagation method works best for you. I would allow leaves or stem tip cuttings a day to dry until planted. So, wait for new growth and be careful not to overwater the move a pot size up once plenty of growth has happened.",,"Baby rubber plant, American rubber plant, Pepper face plant", Peperomia obtusifolia (botanical/scientific).
Mexico.,Height 12 – 18in/30.5 – 45.5cm.,"The fruit and flowers are non-toxic to pets, but the glochids are moderately irritating to the skin.","This cactus enjoys temperatures ranging from 70-100°F (21-37°C), but demands cooler temperatures during the winter months. Starting in the late fall, this cactus should be kept between 50-65°F (10-18°C), and away from central heating vents. The cooler spell is demanded over the course of the entire winter, during which time the segments of cactus will turn a light gray color. Failure to provide these controlled winter conditions will result in plant death the following spring.","Demands full light growing for most of the year, except during the winter cycle. For the plant’s health, light should be reduced to partial sun during this time.","The Polka-dot Cactus is a desert species. It should be given water on a regular basis during its first season in a new pot. This will help it to create a strong root system. The soil should be kept moist, but not soggy. After the first season, more sporadic watering is required. During the winter cycle, the cactus should not be watered at all, with watering to resume in the early spring.","Like most cacti, this specimen demands sandy soil-bases that drain easily. It is usually happy with the pre-packaged cactus soil found in common hardware stores. To increase drainage for a picky plant, mix in a 1:1 ratio of perlite or bark.","Re-potting should take place in the summer, after the year’s bloom has finished. Remember to water the plant regularly to promote the growth of a healthy root system during its first year in the new pot.",Monthly feeding of low nitrogen fertilizer. Fertilization should stop one month before the planned winter cycle for the plant’s health.,Prefers low humidity conditions. Consider running a dehumidifier in the room where the cactus lives to provide it with the most ideal conditions possible.,"Any fully grown pad from this cactus may be broken off cleanly in the early summer and re-potted for propagation purposes. Cuttings work best when grouped in threes or more, and should be buried an inch deep in the soil. Remember to water regularly to promote the growth of a healthy root system in the first year after propagation.",,Bunny ear and polka-dot cactus, Opuntia Microdasys (botanical/scientific) .
South America.,"Height 1m – 1.5m, 6ft indoors.  10ft outdoors.",Toxic for cats and dogs.,The plant thrives in warm temperatures during the summer although the winter months can prove troublesome should the temperature fall below 10°C. It handles changes in day and night time temperatures very well. Temperatures averaging 70°F/21°C – 80°F/26°C are very good and not much below 50°F/10°C.,"A liquid fertilizer will be fine to use every two weeks while the plant is actively growing. During the rest period, the plant will not require fertilizing.",The Century plant does prefer soil that drains very well. This does mean that the loam soil should be used that contains sand so that it remains moist but drains well. The soils should be PH Acid Neutral.,"Like other succulents, the Agave americana does need more water during its growth period. Water enough to make the potting mixture moist but allow two-thirds of the potting mixture to dry out before watering again. During the rest period, the plant requires very little water and only enough to stop the potting mixture from drying out. In its natural sub-tropical and semi-arid regions it spends a lot of time without water and survives well because the leaves are storage organs for water and nutrients.","The plant should be re-potted each spring while it’s growing, moving it in a pot that is one size larger. To enhance drainage a layer of broken crocks in the base of the pot will help drainage. Once the plant has reached the maximum convenient pot size it should be top-dressed during the spring months.","The plant should be re-potted each spring while it’s growing, moving it to a pot that is one size larger. To enhance drainage a layer of broken crocks in the base of the pot will help drainage. Once the plant has reached the maximum convenient pot size it should be top-dressed during the spring months.",The plant will grow well in a room that consists of a normal humidity. Fresh air benefits this species. >,Offsets that can be found at the base of the plant can be used to propagate. Once the offset is around 8-10cm long it can be detached and put into a standard potting mixture. Ensure that it is well rooted and only give it enough water so that the potting mixture is slightly moist. They are also propagated with seeds.,,"Century plant, Agave cactus, Maguey, American aloe", Agave americana (botanical/scientific).
Brazil.,"Height 10 in/25.4 cm, diameter 24 in/61 cm.",Non-Toxic to cats and dogs.,"Temperature: Best kept at 68°F (20°C), although fluctuations from 60-70°F (15-21°C) are tolerated. The plant can be kept at 55-59°F (13-15°C) will grow slowly and allow rest. Plant death can occur at below 50°F (10°C).","During the late fall and all winter long these plants like full, direct sunlight. At any other time of the year, the plants should be grown in partial sun conditions. Too much light during non-flowering times will cause the plant to turn yellow and fail to produce buds in the coming year.","Although a cactus, this is a tropical plant and likes water just like the cactus orchid species. The top inch of soil should be kept moist to the touch at all times. Never allow the soil to become water-logged, or permit water to stand in the pot tray.  Use a pot with drainage holes and pebbles in the bottom to prevent root rot.","This cactus requires a resting period that helps it to bloom again, from Feb – March. During this time keep temperatures at approximately 55°F (12.7°C) and water less. The pre-flowering period from Oct – Nov requires the plant soil to be kept fairly dry until flowers bud, and then resume normal watering and temperatures.","This is best performed in the late spring season. Place the cactus with plenty of room in the container. Re-potting is required every three years to provide additional growth room, although they do prefer being partially pot-bound.",The Christmas Cactus likes being grown in pots. It demands an easily drained growth medium. Suggested is a mixture of 60% potting soil with a pH-balanced formula and either 40% bark or 40% perlite.,Normal room humidity is suggested for this plant. Mist leaves frequently.,"Best propagated through the cutting method. Sections of stem tips at least 3 segments long should be removed from the main plant. These must be left to dry for three or four days. Combine the three cuttings and place at least one inch deep in the soil. For best results, cuttings should be taken in early summer.",,Christmas and holiday cactus," Schlumbergera Bridgesii, S. × buckleyi(botanical/scientific)."
Mexico,Height upto 1 ft (30 cm).,Mildly toxic for cats and dogs.,"It is more suited to hotter climates and this means that temperatures below freezing will damage the plants. Moving the plant indoors during cold snaps will help to maintain its growth and health, especially if placed on a windowsill that is western or southern facing. N No lower than 50 °F (10°F) – 55°F (12.7°C) is best and during summer between 65°F (18°C) – 75°F – (23.8°C+).","Some direct light is preferable for this plant. South facing windows are ideal or west, north facing will not encourage growth. It can handle cooler climates and hotter climates and because it can handle drought conditions it can be placed in areas that are exposed to long periods of sunlight.","Even though the Sedum rubrotinctum has the ability to cope with dry conditions it will require extra water during the spring and summer months. However, it is important to give the plant time to dry out before watering it again.","Due to its hardy nature, it has the ability to deal with a number of soil types although it does not do particularly well in soils that do not drain well. A cactus ready mix works well.",I would suggest a grower repot every two years unless the plant as outgrown the pot. This is best done during spring.,During the spring and summer months it should be fertilized once a month with a diluted liquid feed at maybe half the strength.,Normal room humidity is fine. Providing air circulation during the warmer months is advised (open doors or windows).,"To achieve this, leaves that are situated on the stem will have to be removed and dried out. Once dry, they can be placed in moist soil, ensuring that the soil remains moist until the cutting begins to grow.",,"Christmas cheer, Pork and beans", Sedum rubrotinctum (botanical/scientific).
Africa and then developed in Thailand to the Lactea crest.,Height 9 in – 15 in.,Toxic to cats and dogs (see description).,The Coral likes it’s sunshine and warm conditions which help it to grow and maintain’s it’s health. A partially sunny spot and average temperatures of no lower than approximately 60°F (15°C) will suffice.,"These do prefer good light conditions and sunlight, although it’s best to provide them with partial sunlight and shade in high temperatures. This is the type of plant that grows lopsided if it only receives sunlight on one side, which is worth noting.","Before watering the coral cactus check underneath the pot through the drainage holes to see if the roots are dry. If so then add some water. Do not water too often to prevent over watering, that can potentially kill it off.",A cactus soil mix will be fine. The mix needs to be a type that is light and drains easily to prevent the roots from getting water logged.,"Re-pot only when necessary (becomes pot bound, but that’s unlikely). It may be safest to re-pot as soon as you get the Coral home in-case the mix, pot or both are not adequate.","Using fertiliser once each season is a good method, but not in the winter. A good succulent and cacti product bought will provide the correct instructions to follow.",,"These are propagated with cuttings taken in spring, which need to be dried out for a couple of weeks before potting (source; EwaterPlant Bangkok). Do remember that the sap from the Coral is poisonous, so take precautions (gloves – protective eye-wear).",,Coral cactus, Eurphorbia lactea crest (botanical/scientific).
South Mexico.,Stems trail from 1 – 3 ft long .,Non-toxic to cats and dogs.,Temperatures averaging 65°F/18°C – 80°F/26°C are very good and not much below 50°F/10°C. During winter it is fine if the temperature drops down and it can encourage them to actually bloom in the forthcoming spring season.,"For this species to grow well you will need to at least provide a good amount of direct light. And, if you can sunshine, but not too much during the afternoon summer sun.","During the growing season from April – September water the plant thoroughly and then water when the soil becomes dry to the touch. During winter cut down on the watering, which the plant may only need once a month. Remember it’s a succulent and stores water in it leaves and stems…when you think it’s lacking water it is not. Underwatering is much safer that overwatering and it’s the No 1 killer for this plant.",Potting mix that keeps the roots well aerated and drains well is required. To keep it simple I would pot up with a ready made cactus soil mix.,You will only need to repot this plant during spring when the existing pot has become to small for it and use a shallow pot (the roots do not grow very long).,,"Normal room humidity seems to work fine. Try and provide plenty of air circulation (open windows, doors, etc.) during summer.",Two methods are suitable for propagation. Leaf cuttings can be taken and placed in soil after the leaves have been left to dry for about 2 – 3 days. A couple of inches of stem can also be taken at the tip of the plant stems. After placing the stem tips in soil (only keep 2 or 3 leaves and remove others) and watering the soil once. I would not water again until I could see some sign of growth in case overwatering kills it.,,Donkey’s and Burros Tail, Sedum Morganianum (botanical/scientific).
Brazil.,Height 25 in/63 cm.,Non-Toxic to cats and dogs.,"Temperature: The tropical Hatiora gaertneri prefers spring, summer, and fall temperatures around 75-80°F (24-27°C). Winter temperatures should be between 45-6°5F (7-18°C) only.",This tropical cacti likes bright partial light only. It should never be exposed to full sunlight or midday sunlight.,"Soil should be kept constantly moist, but never soggy. Do not allow water to sit in the dish underneath.","Due to its natural growing environment being on rocks or trees, this cactus requires rough soil to grow well. A 1:1 mixture of potting soil to pumice, tree bark, or perlite is required. Pumice is preferred.",Never re-pot during the bloom or following resting period. Re-pot by removing only the loose soil around the roots. Transfer immediately to a size larger pot and pack in with appropriate soil.,"The Easter cactus prefers fertilization every 14 days. Use a balanced 10-10-10 fertilizer, and dilute to half strength. Do not fertilize during resting period.","Hatiora gaertneri requires a humid environment to survive. The plant should be misted with a sprayer daily, even during the rest period, to simulate the needed humidity.","Any segment at least 3 inches long can be used for propagation. Allow the cutting to harden for at least 48 hours. Plant the small end of the segment in shallow, moist perlite. Rooting occurs between 3-4 weeks.",,Easter or holiday cactus, Hatiora Gaertneri (botanical/scientific).
Canary Islands.,Max 3ft tall.,Not known.,Temperatures averaging 70°F/21°C – 85°F/29.4°C. Avoid below 50°F/10°C. During summer this species will appreciate being taken outside and then brought back in when colder weather sets in.,"Provide at least a few hours sun each day. If you have south facing space to place the plant then great. West and east if south is not available, although growth may be slower.","During spring and summer provide a good watering when the top soil of the pot has started drying, to the touch. During winter cut down the water supply and allow longer periods of the top soil to dry out.",I would use a cactus soil mix already made. This soil provides enough drainage for the roots and air. Your own mix would need to be 1 part non peat soil and 1 part course sand (one option).,The Housetree leek is quite a fast growing plant. You may need to repot every year at first then when growth slows down every 2 years. A clay pot is best used that will allow water to evaporate easier than plastic pots.,From April – August I would use a weak liquid feed diluted only once every 2 weeks.,The humidity within most homes are suitable.,"2 – 4 cm stem tip cuttings can be taken then propagated with one rosette intact (use rooting hormone powder on the cut to encourage growth). Only allow the water to be moist (not soaked) then when you see new growth after a couple of weeks or so you can care for it as you do the parent plant. Also provide warm temperatures (end of spring..start of summer). You can also propagate using seeds, however, this is tricky for many growers and you will require temperatures to be between 70°F/21°C – 80°F/26°C.",,"Housetree Leek, Black Rose Tree", Aeonium Arboreum – var. Atropurpureum and Zwartkop/Schwarzkopf (botanical/scientific).
Madagascar.,18 inches in height.,Toxic to cats and dogs.,"Average room temperatures from 65°F/18.3°C – 75°F/23.8°C and no lower than 50°F/10°C, is best; avoiding frost if they are grown or sitting outside for a period of time.","The F. katy is a tough plant which can tolerate various lighting conditions, although it enjoys resting on a windowsill that is bright, but not too much direct sunlight during the summer. Some growers around October time will try and provide the plant with plenty of dark hours at night (up to 14 hours) to allow it to rest to encourage future blooms.",Because it’s a succulent it will hold water within it’s leaves. There’s no need to keep the soil damp all the time. When they need watering it’s a good idea to give them plenty and then allow the soil to become dry again.,When grown outside the plant thrives in most soils. Grown indoors a good potting mix that drains well will suffice.,These are re-potted around spring time. Do be careful when re-potting because the leaves can snap easily. They are kind of brittle.,"A standard liquid fertiliser diluted can be used once a month or so from spring until the end of summer. Check the instructions, for the fertilizer bought.",Normal room humidity is fine and they do not require misting.,"These are easily propagated by stem cuttings or leaf cuttings ( spring or summer). Treat them like other succulents and allow the cutting to dry out for a few days, then plant the cuttings in soil. A root should be forming within a couple of weeks or so, and then wait for new growth.",,Flaming katy, — Kalanchoe blossfeldiana (botanical/scientific).
North Mexico.,"Height 18 in/45 cm, diameter 10 in/25 cm.",Not known.,"Average temperatures between 60-80°F (15-21°C) from spring until fall, and between 50-55°F (10-12°C) during winter.",Desert cacti loves sun in it’s natural habitat and will grow well if you provide plenty of sunshine or partially shaded.,"It’s best to water the plant when the soil becomes dry from spring until near the end of fall. Just before the end of fall and throughout winter water now and again, only. If the cacti begins to shrivel then do water straight away, otherwise if it’s dry and not shrivelling it’s doing fine.","A well draining soil mix is advised..something like 60% perlite, 20% peat, and 20% compost, or a variation of this. You can buy a mix that is prepared if you do not want to prepare your own. You can add a type of gravel mix or small pebbles, laid at the top ( maybe an inch deep) which gives the cactus a dry desert look.",When they’re young (up to 3 -4 years) you can re-pot in to a slightly bigger pot every spring. After 3 -4 years only re-pot when necessary.,,Normal indoor humidity is fine for the Goat’s horn cactus and provide fresh air when it’s hot inside.,These are easily propagated with seeds and the germination temperature should be approximately 70°F – 80°F (21°C – 26.6°C).,,Goat’s horn cactus, Astrophytum Capricorne (botanical/scientific).
Mexico.,Height 60in (24cm). Diameter 36in (91cm).,Not known.,Temperatures averaging 50°F/10°C – 75°F/23.8°C are ideal but not below 40°F/5°C and avoid frost.,Plenty of sunshine will keep this cacti more than happy. In a glass room you may have to provide some shade during a hot summers day to prevent sunburn.,"From spring until fall; water similar to many other house plants by watering when the soil begins drying. Before and during winter barely water the plant. Overwatering, especially when the temperature becomes cold can rot this species.",A pot mixture used for cactus plants that drains well will suffice. Adding gravel or small pebbles at the bottom first few inches of the pot will encourage drainage.,When they are young and growing it’s best to re-pot these once a year; during spring in a slightly bigger container. Once they mature re-pot maybe every 2 – 3 years or when necessary.,Feed every 4 weeks with a high potassium fertilizer during summer.,"Humidity does not seem to be a major concern for the Echinocactus grusonii, which makes the average indoor environment fine, as it is. Provide as much fresh air as you can , but not cold drafts.",These are propagated with seeds once it fruits after flowering.,,"Golden barrel cactus , golden ball cactus, mother-in-law’s cushion",– Echinocactus Grusonii (botanical/scientific).
South Africa.,"Height = 3ft or much less, as a bonsai.",Toxic to cats and dogs.,Room temperatures of around 60°f / 15.5°c — 75°f / 24°c are ideal. Winter no less than 50°f / 10°c.,"The jade plant flourishes in good health with plenty of light. If you provide a few hours of sunshine a day, you will have a happy plant.","It’s best to allow the soil to dry between each watering, depending on the time of year, how much humidity, and the amount of sunlight it’s getting. Allowing too much water to sit at the bottom of the pot with the roots will cause them to rot (avoid this).","A good draining soil mix that is gritty is advisable to use, which is sold and used for cacti and succulents.","Re-pot (spring-summer) when the plant becomes root bound, or the soil needs renewing. A good solid and heavy pot is best to use because Jade plants are well known for being top-heavy. A heavy pot will prevent them from tipping over.",Feed each week or two (maybe less) with a weak or diluted liquid fertilizer. A fertilizer made for succulents may be your best bet; that does not need to be a high-strength type.,"They naturally survive in quite humid conditions, although you will please them with water mist.","Propagating is achieved with leaf or stem cuttings which are placed into a soil mix, then waited until they show some growth. Before placing them in the soil mix, you will prevent potential problems from the sap seeping out by allowing them to dry on a windowsill for a few days or so.",,"Jade, money, lucky, friendship"," Crassula Ovata, C.portulacea, C.argentea (botanical/scientific)."
